{
  "keys": ["device:<dc-fw>"],
  "schema": "health-netflow-check/v1",
  "source": "netflow",
  "watch_id": "2026-10-26T21-00-00Z",
  "checked_at": "2026-10-26T21:00:00Z",
  "ok": true,
  "status": "ok",
  "headline": "Baseline. 6 exporters reporting. Largest path <web> to <api> api. 31 other paths kept on the board.",
  "window": "1h",
  "window_start": "2026-10-26T20:00:00Z",
  "window_end": "2026-10-26T21:00:00Z",
  "coverage": { "state": "complete", "detail": "F1, F2, and F3 returned. Paths are named device to device, not one row per flow." },
  "metrics": [
    { "at": "2026-10-26T21:00:00Z", "scope": "estate", "exporters": 6, "exporters_silent": 0, "exporters_unresolved": 0, "flows": 12000, "bytes": 4000000, "conversations": 36, "conversations_absent": 0, "top_scope": "flow:<dc-fw-ip>/<web>><api>:api/tcp" }
  ],
  "readings": [
    {
      "kind": "exporter",
      "scope": "exporter:<dc-fw-ip>",
      "source": "<dc-fw-ip>",
      "exporter_name": "<dc-fw>",
      "exporter_site": null,
      "device": "<dc-fw>",
      "exporter": null,
      "src": null, "dst": null, "dst_port": null, "protocol": null,
      "src_device": null, "dst_device": null,
      "keys": ["device:<dc-fw>"],
      "at": "2026-10-26T21:00:00Z",
      "state": "reporting",
      "bytes": 4000000,
      "flows": 8000,
      "last_flow_at": "2026-10-26T20:59:40Z",
      "last_seen_at": null,
      "note": "Baseline."
    },
    {
      "kind": "conversation",
      "scope": "flow:<dc-fw-ip>/<web>><api>:api/tcp",
      "source": "<dc-fw-ip>",
      "exporter_name": "<dc-fw>",
      "exporter_site": null,
      "device": null,
      "exporter": "<dc-fw>",
      "src": "<web>",
      "dst": "<api>",
      "dst_port": "api",
      "protocol": "tcp",
      "src_device": null,
      "dst_device": null,
      "keys": ["device:<dc-fw>"],
      "at": "2026-10-26T21:00:00Z",
      "state": "present",
      "bytes": 617136,
      "flows": 1794,
      "last_flow_at": null,
      "last_seen_at": "2026-10-26T20:59:40Z",
      "note": "Baseline."
    }
  ],
  "unchanged": 31,
  "baseline_ref": null,
  "vs_prior": {
    "prior_watch_id": null,
    "delta": "first",
    "changed": []
  },
  "concerns": []
}
